{
  "schema_version": 1,
  "owner": "kmadhok",
  "generated_at": "2026-07-20T14:29:07Z",
  "repositories": [
    {
      "name": "AdvancedCompVisionProject",
      "name_with_owner": "kmadhok/AdvancedCompVisionProject",
      "url": "https://github.com/kmadhok/AdvancedCompVisionProject",
      "description": null,
      "visibility": "public",
      "is_private": false,
      "is_archived": false,
      "is_fork": false,
      "is_template": false,
      "has_issues_enabled": true,
      "default_branch": "main",
      "primary_language": "Jupyter Notebook",
      "topics": [],
      "homepage_url": null,
      "disk_usage_kb": 83546,
      "pushed_at": "2024-05-20T14:44:18Z",
      "updated_at": "2024-05-20T14:44:22Z"
    },
    {
      "name": "Agent_Trading",
      "name_with_owner": "kmadhok/Agent_Trading",
      "url": "https://github.com/kmadhok/Agent_Trading",
      "description": null,
      "visibility": "public",
      "is_private": false,
      "is_archived": false,
      "is_fork": false,
      "is_template": false,
      "has_issues_enabled": true,
      "default_branch": "main",
      "primary_language": null,
      "topics": [],
      "homepage_url": null,
      "disk_usage_kb": 0,
      "pushed_at": "2026-03-07T16:32:02Z",
      "updated_at": "2026-03-07T16:32:05Z"
    },
    {
      "name": "AI-News-Aggregator",
      "name_with_owner": "kmadhok/AI-News-Aggregator",
      "url": "https://github.com/kmadhok/AI-News-Aggregator",
      "description": "Aggregate AI news across various data sources",
      "visibility": "private",
      "is_private": true,
      "is_archived": false,
      "is_fork": false,
      "is_template": false,
      "has_issues_enabled": true,
      "default_branch": "main",
      "primary_language": "Python",
      "topics": [],
      "homepage_url": null,
      "disk_usage_kb": 2548,
      "pushed_at": "2026-07-18T22:04:09Z",
      "updated_at": "2026-07-18T19:51:41Z"
    },
    {
      "name": "AlgoTradeFramework",
      "name_with_owner": "kmadhok/AlgoTradeFramework",
      "url": "https://github.com/kmadhok/AlgoTradeFramework",
      "description": null,
      "visibility": "public",
      "is_private": false,
      "is_archived": false,
      "is_fork": true,
      "is_template": false,
      "has_issues_enabled": false,
      "default_branch": "master",
      "primary_language": "Python",
      "topics": [],
      "homepage_url": null,
      "disk_usage_kb": 10574,
      "pushed_at": "2022-12-08T10:43:07Z",
      "updated_at": "2025-02-22T21:00:16Z"
    },
    {
      "name": "amazon-a2i-sample-jupyter-notebooks",
      "name_with_owner": "kmadhok/amazon-a2i-sample-jupyter-notebooks",
      "url": "https://github.com/kmadhok/amazon-a2i-sample-jupyter-notebooks",
      "description": "Sample Jupyter Notebooks for Amazon Augmented AI (A2I)",
      "visibility": "public",
      "is_private": false,
      "is_archived": false,
      "is_fork": true,
      "is_template": false,
      "has_issues_enabled": false,
      "default_branch": "master",
      "primary_language": "Jupyter Notebook",
      "topics": [],
      "homepage_url": "https://aws.amazon.com/augmented-ai/",
      "disk_usage_kb": 48801,
      "pushed_at": "2021-09-11T01:50:55Z",
      "updated_at": "2022-03-16T22:45:45Z"
    },
    {
      "name": "Article_Extraction",
      "name_with_owner": "kmadhok/Article_Extraction",
      "url": "https://github.com/kmadhok/Article_Extraction",
      "description": null,
      "visibility": "public",
      "is_private": false,
      "is_archived": false,
      "is_fork": false,
      "is_template": false,
      "has_issues_enabled": true,
      "default_branch": "main",
      "primary_language": "Python",
      "topics": [],
      "homepage_url": null,
      "disk_usage_kb": 5,
      "pushed_at": "2025-02-10T14:16:49Z",
      "updated_at": "2025-02-10T14:16:53Z"
    },
    {
      "name": "Automate_Job_Search",
      "name_with_owner": "kmadhok/Automate_Job_Search",
      "url": "https://github.com/kmadhok/Automate_Job_Search",
      "description": null,
      "visibility": "public",
      "is_private": false,
      "is_archived": false,
      "is_fork": false,
      "is_template": false,
      "has_issues_enabled": true,
      "default_branch": "main",
      "primary_language": "Python",
      "topics": [],
      "homepage_url": null,
      "disk_usage_kb": 131,
      "pushed_at": "2026-03-31T19:12:11Z",
      "updated_at": "2026-03-31T19:12:15Z"
    },
    {
      "name": "Autonomous-Data-Analyst",
      "name_with_owner": "kmadhok/Autonomous-Data-Analyst",
      "url": "https://github.com/kmadhok/Autonomous-Data-Analyst",
      "description": null,
      "visibility": "private",
      "is_private": true,
      "is_archived": false,
      "is_fork": false,
      "is_template": false,
      "has_issues_enabled": true,
      "default_branch": "main",
      "primary_language": "Python",
      "topics": [],
      "homepage_url": null,
      "disk_usage_kb": 271,
      "pushed_at": "2026-03-31T02:56:07Z",
      "updated_at": "2026-03-31T02:56:11Z"
    },
    {
      "name": "Autonomous-Semantic-Layer",
      "name_with_owner": "kmadhok/Autonomous-Semantic-Layer",
      "url": "https://github.com/kmadhok/Autonomous-Semantic-Layer",
      "description": null,
      "visibility": "private",
      "is_private": true,
      "is_archived": false,
      "is_fork": false,
      "is_template": false,
      "has_issues_enabled": true,
      "default_branch": "main",
      "primary_language": "Python",
      "topics": [],
      "homepage_url": null,
      "disk_usage_kb": 156,
      "pushed_at": "2026-03-29T16:40:03Z",
      "updated_at": "2026-03-29T16:40:07Z"
    },
    {
      "name": "AutoResearch",
      "name_with_owner": "kmadhok/AutoResearch",
      "url": "https://github.com/kmadhok/AutoResearch",
      "description": null,
      "visibility": "private",
      "is_private": true,
      "is_archived": false,
      "is_fork": false,
      "is_template": false,
      "has_issues_enabled": true,
      "default_branch": "main",
      "primary_language": "Python",
      "topics": [],
      "homepage_url": null,
      "disk_usage_kb": 114,
      "pushed_at": "2026-07-11T19:53:26Z",
      "updated_at": "2026-07-11T19:53:30Z"
    },
    {
      "name": "Bank-Loan-Acceptance",
      "name_with_owner": "kmadhok/Bank-Loan-Acceptance",
      "url": "https://github.com/kmadhok/Bank-Loan-Acceptance",
      "description": null,
      "visibility": "public",
      "is_private": false,
      "is_archived": false,
      "is_fork": true,
      "is_template": false,
      "has_issues_enabled": false,
      "default_branch": "main",
      "primary_language": "Jupyter Notebook",
      "topics": [],
      "homepage_url": null,
      "disk_usage_kb": 4907,
      "pushed_at": "2022-04-23T14:44:21Z",
      "updated_at": "2022-04-24T21:49:21Z"
    },
    {
      "name": "Brainrot",
      "name_with_owner": "kmadhok/Brainrot",
      "url": "https://github.com/kmadhok/Brainrot",
      "description": null,
      "visibility": "public",
      "is_private": false,
      "is_archived": false,
      "is_fork": false,
      "is_template": false,
      "has_issues_enabled": true,
      "default_branch": "main",
      "primary_language": "Python",
      "topics": [],
      "homepage_url": null,
      "disk_usage_kb": 6,
      "pushed_at": "2025-03-08T03:50:48Z",
      "updated_at": "2025-03-08T03:50:51Z"
    },
    {
      "name": "CapstoneRag",
      "name_with_owner": "kmadhok/CapstoneRag",
      "url": "https://github.com/kmadhok/CapstoneRag",
      "description": null,
      "visibility": "public",
      "is_private": false,
      "is_archived": false,
      "is_fork": false,
      "is_template": false,
      "has_issues_enabled": true,
      "default_branch": "",
      "primary_language": null,
      "topics": [],
      "homepage_url": null,
      "disk_usage_kb": 0,
      "pushed_at": "2024-06-21T04:57:01Z",
      "updated_at": "2024-06-21T04:58:21Z"
    },
    {
      "name": "CapstoneRepo",
      "name_with_owner": "kmadhok/CapstoneRepo",
      "url": "https://github.com/kmadhok/CapstoneRepo",
      "description": null,
      "visibility": "private",
      "is_private": true,
      "is_archived": false,
      "is_fork": false,
      "is_template": false,
      "has_issues_enabled": true,
      "default_branch": "main",
      "primary_language": "Python",
      "topics": [],
      "homepage_url": null,
      "disk_usage_kb": 4127,
      "pushed_at": "2024-06-19T17:22:12Z",
      "updated_at": "2024-06-19T17:22:17Z"
    },
    {
      "name": "Chicago-Crime-Data-Analysis",
      "name_with_owner": "kmadhok/Chicago-Crime-Data-Analysis",
      "url": "https://github.com/kmadhok/Chicago-Crime-Data-Analysis",
      "description": "Analysis of Chicago Crime",
      "visibility": "public",
      "is_private": false,
      "is_archived": false,
      "is_fork": false,
      "is_template": false,
      "has_issues_enabled": true,
      "default_branch": "main",
      "primary_language": "HTML",
      "topics": [],
      "homepage_url": null,
      "disk_usage_kb": 11206,
      "pushed_at": "2023-06-11T17:17:43Z",
      "updated_at": "2023-06-11T17:17:48Z"
    },
    {
      "name": "ChicagoFoodSafety",
      "name_with_owner": "kmadhok/ChicagoFoodSafety",
      "url": "https://github.com/kmadhok/ChicagoFoodSafety",
      "description": null,
      "visibility": "private",
      "is_private": true,
      "is_archived": false,
      "is_fork": false,
      "is_template": false,
      "has_issues_enabled": true,
      "default_branch": "main",
      "primary_language": "Jupyter Notebook",
      "topics": [],
      "homepage_url": null,
      "disk_usage_kb": 1,
      "pushed_at": "2024-01-10T04:44:01Z",
      "updated_at": "2024-01-10T04:44:05Z"
    },
    {
      "name": "CodingFun",
      "name_with_owner": "kmadhok/CodingFun",
      "url": "https://github.com/kmadhok/CodingFun",
      "description": null,